,ID,Text,Date Created,Username,Twitter Screen Name,Location,Cleaned Text,Retweet,Retweeted Person
0,1136737968650166272,b'RT @elijahdaniel: it\xe2\x80\x99s pride month \xf0\x9f\x8c\x88  time for a thread of all the dumb gay shit I\xe2\x80\x99ve done the past couple years. We\xe2\x80\x99ll start easy:\nthat ti\xe2\x80\xa6',2019-06-06 20:53:45,GOD,deadofphangirl,"Wisconsin, USA",elijahdaniel it pride month   time for a thread of all the dumb gay shit I done the past couple years We start easynthat ti,True,@elijahdaniel:
1,1136737968532709376,b'RT @NHSMillion: If everyone who opposes Donald Trump\xe2\x80\x99s plans for our NHS followed and retweeted we\xe2\x80\x99d reach a million before he gets home\n\nh\xe2\x80\xa6',2019-06-06 20:53:45,Buxton ❤️ Europe,BxtnLovesEurope,"Buxton and High Peak, Derbyshire",NHSMillion If everyone who opposes Donald Trump plans for our NHS followed and retweeted we reach a million before he gets homennh,True,@NHSMillion:
2,1136737967630950403,"b""@GOP Instead... support someone who doesn't lie all the time like....\n\nDonald Trump?\n\noh.""",2019-06-06 20:53:45,A Young Low Level Volunteer Named George,LowLevelGeorge,White House Drop Ceiling,GOP Instead support someone who doesnt lie all the time likennDonald Trumpnnoh,False,None
3,1136737964866777088,"b'@realDonaldTrump it isn\'t ""fake"" when ALL of your quotes were recorded or witnessed.\n#WorstPresidentEVER\n\nhttps://t.co/vojku7CSRa'",2019-06-06 20:53:45,Steve Lee,SteveLeeHwd,"Hollywood, CA",realDonaldTrump it isn fake when ALL of your quotes were recorded or witnessednWorstPresidentEVERnnhttpstcovojku7CSRa,False,None
4,1136737959141679105,b'RT @PalmerReport: Donald Trump\xe2\x80\x99s day so far:\n\n- Calls Chuck Schumer a \xe2\x80\x9ccreep\xe2\x80\x9d\n- Calls Bette Midler a \xe2\x80\x9cpsycho\xe2\x80\x9d\n- Who the fuck attacks Bette\xe2\x80\xa6',2019-06-06 20:53:43,Albert F Support Dem,afaduln2,The world,PalmerReport Donald Trump day so farnn Calls Chuck Schumer a  Calls Bette Midler a  Who the fuck attacks Bette,True,@PalmerReport:
5,1136737958202171392,b'RT @PalmerReport: Donald Trump held up the start of today\xe2\x80\x99s D-Day ceremony for fifteen minutes so he could sit down with Fox News and insul\xe2\x80\xa6',2019-06-06 20:53:43,USAinDanger,EmergencyDays,"Secret ville, NOYB",PalmerReport Donald Trump held up the start of today DDay ceremony for fifteen minutes so he could sit down with Fox News and insul,True,@PalmerReport:
6,1136737956939669512,b'RT @BradWillmore: @MariekeWalsh @ToddSmithPC @AndrewScheer Sounds like Donald Trump.',2019-06-06 20:53:43,NNorma,NNorma192,,BradWillmore MariekeWalsh ToddSmithPC AndrewScheer Sounds like Donald Trump,True,@BradWillmore:
7,1136737951679897606,"b""RT @Nicoxw1: Vladimir Putin wasn't invited to the D-Day commemoration, leaving Donald Trump as Russia's only representative.\n#DDay75thAnniv\xe2\x80\xa6""",2019-06-06 20:53:41,Theresa Hoover,FullHoover,"San Diego, CA",Nicoxw1 Vladimir Putin wasnt invited to the DDay commemoration leaving Donald Trump as Russias only representativenDDay75thAnniv,True,@Nicoxw1:
8,1136737947439362048,"b'RT @snowycats: Donald Trump and Bette Midler Are Feuding, but the Actress Managed to Perfectly Shut Him Down https://t.co/Kp6DyCxjvS.  What\xe2\x80\xa6'",2019-06-06 20:53:40,danny jackson,irenenog,"Western Australia, Australia",snowycats Donald Trump and Bette Midler Are Feuding but the Actress Managed to Perfectly Shut Him Down httpstcoKp6DyCxjvS  What,True,@snowycats:
9,1136737942330888192,b'RT @Strandjunker: Donald Trump came down harder on Bette Midler for tweeting than he did on Saudi crown prince Mohammad bin Salman for lite\xe2\x80\xa6',2019-06-06 20:53:39,tyler ➊,itsTylerMikal,"Too-Muchery Village, Florida",Strandjunker Donald Trump came down harder on Bette Midler for tweeting than he did on Saudi crown prince Mohammad bin Salman for lite,True,@Strandjunker:
10,1136737938904141824,"b""RT @JohnFugelsang: Once again, the media has decided Donald Trump is presidential because he didn't actually swear, sneeze up Adderall powd\xe2\x80\xa6""",2019-06-06 20:53:38,Pastatute,aredmond75,"Mineola, NY",JohnFugelsang Once again the media has decided Donald Trump is presidential because he didnt actually swear sneeze up Adderall powd,True,@JohnFugelsang:
11,1136737938086203397,"b'A @ddale8 article from 2 years ago, reminding us that we should never underestimate the number of people who simply\xe2\x80\xa6 https://t.co/Z0o4t1uFLC'",2019-06-06 20:53:38,Edge,czarbucks,Western North Carolina (fled Orlando),A ddale8 article from 2 years ago reminding us that we should never underestimate the number of people who simply httpstcoZ0o4t1uFLC,False,None
12,1136737929219514374,"b""RT @CNN: A recently released Netflix series about the Central Park Five brings attention to Trump's controversial role in pushing for the d\xe2\x80\xa6""",2019-06-06 20:53:36,DM,dustinmcd123,,CNN A recently released Netflix series about the Central Park Five brings attention to Trumps controversial role in pushing for the d,True,@CNN:
13,1136737926535159815,"b""RT @CNN: A recently released Netflix series about the Central Park Five brings attention to Trump's controversial role in pushing for the d\xe2\x80\xa6""",2019-06-06 20:53:35,Austin Jimenez,AustinJimenez,"Miami, FL",CNN A recently released Netflix series about the Central Park Five brings attention to Trumps controversial role in pushing for the d,True,@CNN:
14,1136737925952151559,"b'RT @PartidoPSUV: Trump contra Am\xc3\xa9rica Latina: Amenazas, bloqueos y sanciones https://t.co/V04uRMtRBG  https://t.co/DADqo4SgwT\n\n #RumboALaPo\xe2\x80\xa6'",2019-06-06 20:53:35,claps bicentenario,clabicentenario,"Ureña, Venezuela",PartidoPSUV Trump contra Am Latina Amenazas bloqueos y sanciones httpstcoV04uRMtRBG  httpstcoDADqo4SgwTnn RumboALaPo,True,@PartidoPSUV:
